{
  "$schema": "https://json-schema.org/draft/2020-12/schema",
  "$id": "rename.schema.json",
  "type": "object",
  "required": ["schemaVersion", "ok", "meshRevision", "session"],
  "properties": {
    "schemaVersion": {"$ref": "common.schema.json#/$defs/schemaVersion"},
    "ok": {"type": "boolean", "const": true},
    "meshRevision": {"$ref": "common.schema.json#/$defs/nullableRevision"},
    "session": {"$ref": "common.schema.json#/$defs/sessionLifecycle"}
  }
}
